<?xml version="1.0" encoding="UTF-8"?>
<tns:dsl xmlns:tns="http://www.genarview.pmmc.pro/genarview-dsl-1.0" xmlns:xsi="http://www.w3.org/2001/XMLSchema-instance" xsi:schemaLocation="http://www.genarview.pmmc.pro/genarview-dsl-1.0 genarview-dsl-1.0.xsd ">
  <tns:lookFor>
  <tns:metadata level="Class">javax.inject.Named</tns:metadata>
  <tns:metadata level="Class">javax.servlet.annotation.WebServlet</tns:metadata>
  <tns:metadata level="Class">javax.jws.WebService</tns:metadata>
  <tns:metadata level="Class">javax.xml.ws.WebServiceRef</tns:metadata>
  <tns:metadata level="Class">javax.ejb.MessageDriven</tns:metadata>
  
  <tns:metadata level="Class">javax.persistence.Entity</tns:metadata>   
  <tns:metadata level="Class">javax.persistence.Table</tns:metadata>
  <tns:metadata level="Class">javax.persistence.JoinTable</tns:metadata>
  <tns:metadata level="Class">javax.persistence.AuditJoinTable</tns:metadata>
  <tns:metadata level="Class">javax.ws.rs.Path</tns:metadata>
  <tns:metadata level="Class">javax.ws.rs.GET</tns:metadata>
  <tns:metadata level="Class">javax.ws.rs.POST</tns:metadata>
  <tns:metadata level="Class">javax.ws.rs.PUT</tns:metadata>
  <tns:metadata level="Class">javax.ws.rs.QueryParam</tns:metadata>
  <tns:metadata level="Class">javax.ws.rs.Consumes</tns:metadata>
  <tns:metadata level="Class">javax.ws.rs.Produces</tns:metadata>
  <tns:metadata level="Class">javax.ws.rs.OPTIONS</tns:metadata>
  
  <tns:methodCall>createQuery</tns:methodCall>
  </tns:lookFor>
  <tns:hintHards>
  	<!-- ANDROID -->
    <tns:hintSource name="Activity">
    	<tns:componentType>Activity</tns:componentType>
    	<tns:hintAnd>
		        <tns:hint>
		        	<tns:class>pro.pmmc.genarview.functional.predicate.node.PWithUnitExtendsImported</tns:class>
		        	<tns:value key="baseClassFullName">android.app.Activity</tns:value>
		        </tns:hint>
	    </tns:hintAnd>
    </tns:hintSource>
    <tns:hintSource name="Fragment">
    	<tns:componentType>Fragment</tns:componentType>
    	<tns:hintAnd>
		        <tns:hint>
		        	<tns:class>pro.pmmc.genarview.functional.predicate.node.PWithUnitExtendsImported</tns:class>
		        	<tns:value key="baseClassFullName">android.app.Fragment</tns:value>
		        </tns:hint>
	    </tns:hintAnd>
    </tns:hintSource>
    <tns:hintSource name="Service">
    	<tns:componentType>Service</tns:componentType>
    	<tns:hintOr>
		        <tns:hint>
		        	<tns:class>pro.pmmc.genarview.functional.predicate.node.PWithUnitExtendsImported</tns:class>
		        	<tns:value key="baseClassFullName">android.app.Service</tns:value>
		        </tns:hint>
		        <tns:hint>
		        	<tns:class>pro.pmmc.genarview.functional.predicate.node.PWithUnitExtendsImported</tns:class>
		        	<tns:value key="baseClassFullName">android.app.IntentService</tns:value>
		        </tns:hint>
	    </tns:hintOr>
    </tns:hintSource>
    <tns:hintSource name="BroadcastReceiver">
    	<tns:componentType>BroadcastReceiver</tns:componentType>
    	<tns:hintAnd>
		        <tns:hint>
		        	<tns:class>pro.pmmc.genarview.functional.predicate.node.PWithUnitExtendsImported</tns:class>
		        	<tns:value key="baseClassFullName">android.content.BroadcastReceiver</tns:value>
		        </tns:hint>
	    </tns:hintAnd>
    </tns:hintSource>
    <tns:hintSource name="ContentProvider">
    	<tns:componentType>ContentProvider</tns:componentType>
    	<tns:hintAnd>
		        <tns:hint>
		        	<tns:class>pro.pmmc.genarview.functional.predicate.node.PWithUnitExtendsImported</tns:class>
		        	<tns:value key="baseClassFullName">android.content.ContentProvider</tns:value>
		        </tns:hint>
	    </tns:hintAnd>
    </tns:hintSource> 
  	<!-- JEE -->
    <!-- tns:hintSource name="Stateless">
    	<tns:componentType>EJB</tns:componentType>
    	<tns:componentType>SessionEJB</tns:componentType>
    	<tns:componentType>Stateless</tns:componentType>
  		<tns:hintOr>
		        <tns:hint>
		        	<tns:class>pro.pmmc.genarview.functional.predicate.node.PWithAnnotation</tns:class>
		        	<tns:value key="annotationLevel">TYPE</tns:value>
	      			<tns:value key="annotationName">Stateless</tns:value>
		        </tns:hint>
	    </tns:hintOr>
    </tns:hintSource>
    <tns:hintSource name="Stateful">
    	<tns:componentType>EJB</tns:componentType>
    	<tns:componentType>SessionEJB</tns:componentType>
    	<tns:componentType>Stateful</tns:componentType>
  		<tns:hintOr>
		        <tns:hint>
		        	<tns:class>pro.pmmc.genarview.functional.predicate.node.PWithAnnotation</tns:class>
		        	<tns:value key="annotationLevel">TYPE</tns:value>
	      			<tns:value key="annotationName">Stateful</tns:value>
		        </tns:hint>
        </tns:hintOr>
    </tns:hintSource>
    <tns:hintSource name="Singleton">
    	<tns:componentType>EJB</tns:componentType>
    	<tns:componentType>SessionEJB</tns:componentType>
    	<tns:componentType>Singleton</tns:componentType>
  		<tns:hintOr>
		        <tns:hint>
		        	<tns:class>pro.pmmc.genarview.functional.predicate.node.PWithAnnotation</tns:class>
		        	<tns:value key="annotationLevel">TYPE</tns:value>
	      			<tns:value key="annotationName">Singleton</tns:value>
		        </tns:hint>
	    </tns:hintOr>
    </tns:hintSource-->
    
  </tns:hintHards> 
  <!-- tns:queryCompTyper name="Facade">
    	<tns:componentType>Facade</tns:componentType>
    	<tns:class>pro.pmmc.genarview.query.GenericQueryCompTyper</tns:class>
    	<tns:args>
    		<tns:arg>b</tns:arg>
    	</tns:args>
    	<tns:query>MATCH (b:SessionEJB)-[:REFERENCE]->(e1:Type)-[:T_HAS_ANNOTATION]->(a1:Annotation), (b:SessionEJB)-[:REFERENCE]->(e2:Type)-[:T_HAS_ANNOTATION]->(a2:Annotation) WHERE not(e1 = e2) AND (a1.name="Local" OR a1.name="Remote") AND (a2.name="Local" OR a2.name="Remote")  
		</tns:query>
    </tns:queryCompTyper>
    <tns:queryCompTyper name="Dependency injection" >
    	<tns:componentType>DI</tns:componentType>
    	<tns:class>pro.pmmc.genarview.query.GenericQueryCompTyper</tns:class>
    	<tns:args>
    		<tns:arg>b</tns:arg>
    	</tns:args>
    	<tns:query>MATCH (b:Type)-[:T_HAS_ANNOTATION]->(a:Annotation:Field) WHERE a.fullName="javax.inject.Inject"   
		</tns:query>
    </tns:queryCompTyper>
    <tns:queryCompTyper name="Factory method" >
    	<tns:componentType>FactoryMethod</tns:componentType>
    	<tns:class>pro.pmmc.genarview.query.GenericQueryCompTyper</tns:class>
    	<tns:args>
    		<tns:arg>b</tns:arg>
    	</tns:args>
    	<tns:query>MATCH (b:Type)-[:T_HAS_ANNOTATION]->(a:Annotation:Method) WHERE a.fullName="javax.enterprise.inject.Produces"   
		</tns:query>
    </tns:queryCompTyper>
    <tns:queryCompTyper name="Decorator" >
    	<tns:componentType>Decorator</tns:componentType>
    	<tns:class>pro.pmmc.genarview.query.GenericQueryCompTyper</tns:class>
    	<tns:args>
    		<tns:arg>b</tns:arg>
    	</tns:args>
    	<tns:query>MATCH (b:Type)-[:T_HAS_ANNOTATION]->(a:Annotation:Class) WHERE a.fullName="javax.decorator.Decorator"   
		</tns:query>
    </tns:queryCompTyper>
    <tns:queryCompTyper name="Interceptor" >
    	<tns:componentType>Interceptor</tns:componentType>
    	<tns:class>pro.pmmc.genarview.query.GenericQueryCompTyper</tns:class>
    	<tns:args>
    		<tns:arg>b</tns:arg>
    	</tns:args>
    	<tns:query>MATCH (b:Type)-[:T_HAS_ANNOTATION]->(a:Annotation:Class) WHERE a.fullName="javax.interceptor.Interceptor"   
		</tns:query>
    </tns:queryCompTyper>
    <tns:queryCompTyper name="Asynchronous" >
    	<tns:componentType>Asynchronous</tns:componentType>
    	<tns:class>pro.pmmc.genarview.query.GenericQueryCompTyper</tns:class>
    	<tns:args>
    		<tns:arg>b</tns:arg>
    	</tns:args>
    	<tns:query>MATCH (b:Type)-[:T_HAS_ANNOTATION]->(a:Annotation:Method) WHERE a.fullName="javax.ejb.Asynchronous"   
		</tns:query>
    </tns:queryCompTyper>  
    <tns:queryCompTyper name="TimerService" >
    	<tns:componentType>TimerService</tns:componentType>
    	<tns:class>pro.pmmc.genarview.query.GenericQueryCompTyper</tns:class>
    	<tns:args>
    		<tns:arg>b</tns:arg>
    	</tns:args>
    	<tns:query>MATCH (b:Type)-[:T_HAS_ANNOTATION]->(a:Annotation:Method) WHERE a.fullName="javax.ejb.Schedule" OR a.fullName="javax.ejb.Timeout"  
		</tns:query>
    </tns:queryCompTyper>
    <tns:queryCompTyper name="Observer" >
    	<tns:componentType>Observer</tns:componentType>
    	<tns:class>pro.pmmc.genarview.query.GenericQueryCompTyper</tns:class>
    	<tns:args>
    		<tns:arg>b</tns:arg>
    	</tns:args>
    	<tns:query>MATCH (b:Type)-[:T_HAS_ANNOTATION]->(a:Annotation:Param) WHERE a.fullName="javax.enterprise.event.Observes"  
		</tns:query>
    </tns:queryCompTyper>
    <tns:queryCompTyper name="RESTFulService" >
    	<tns:componentType>RESTFulService</tns:componentType>
    	<tns:class>pro.pmmc.genarview.query.GenericQueryCompTyper</tns:class>
    	<tns:args>
    		<tns:arg>b</tns:arg>
    	</tns:args>
    	<tns:query>MATCH (b:Type)-[:T_HAS_ANNOTATION]->(a:Annotation:Class) WHERE a.fullName="javax.ws.rs.Path"   
		</tns:query>
    </tns:queryCompTyper>
    <tns:queryCompTyper name="DataAccess" >
    	<tns:componentType>DataAccess</tns:componentType>
    	<tns:class>pro.pmmc.genarview.query.GenericQueryCompTyper</tns:class>
    	<tns:args>
    		<tns:arg>t</tns:arg>
    	</tns:args>
    	<tns:query>MATCH (t:Type)&gt;(i:TypeImported), (t:Type)[:USE]&gt;(e:Type)&gt;(ae:Annotation) WITH t AS t, i.fullName AS em, ae.fullName AS ety, COUNT(DISTINCT(e)) AS n WHERE em="javax.persistence.EntityManager" AND ety="javax.persistence.Entity" AND n=1   
		</tns:query>
    </tns:queryCompTyper>
    <tns:queryCompTyper name="Entity" >
    	<tns:componentType>Entity</tns:componentType>
    	<tns:class>pro.pmmc.genarview.query.GenericQueryCompTyper</tns:class>
    	<tns:args>